{
 "kind": "BETTOR_PNL_ATTRIBUTION",
 "payload": {
  "by_family": [
   {
    "execution_residual": -0.0002000000000000092,
    "expected_profit": -4.367475661503407,
    "family": "BASEBALL_TEAM_FULL_GAME_WINNER",
    "forecast_residual": -1.907675661503406,
    "management_residual": 0.0,
    "n": 1,
    "outcome_variance": -28.472324338496595,
    "realized_profit": -32.839999999999996,
    "reconciliation_error": -3.552713678800501e-15,
    "residual": -28.47252433849659,
    "settlement_residual": 5.440092820663267e-15
   },
   {
    "execution_residual": -33.660975000000256,
    "expected_profit": -237.4492516049607,
    "family": "MONEYLINE",
    "forecast_residual": 182.8962233950397,
    "management_residual": -776.4278,
    "n": 26,
    "outcome_variance": -6457.93737339504,
    "realized_profit": -7505.4754,
    "reconciliation_error": 2.99107093260087e-13,
    "residual": -7268.02614839504,
    "settlement_residual": -1.1731775273471357e-13
   },
   {
    "execution_residual": 3.9786999999996677,
    "expected_profit": -1911.4605279810355,
    "family": "SOCCER_TEAM_FULL_TIME_WINNER",
    "forecast_residual": -241.4168279810356,
    "management_residual": 0.0,
    "n": 49,
    "outcome_variance": -6630.868172018964,
    "realized_profit": -8538.35,
    "reconciliation_error": 3.352873534367973e-14,
    "residual": -6626.889472018965,
    "settlement_residual": 2.52358897667726e-13
   },
   {
    "execution_residual": -16.864001999999942,
    "expected_profit": -327.54943301406786,
    "family": "SPREAD",
    "forecast_residual": 21.368689985932015,
    "management_residual": -795.7900000000001,
    "n": 15,
    "outcome_variance": -7650.297164985932,
    "realized_profit": -8790.5006,
    "reconciliation_error": 8.525862307817711e-14,
    "residual": -8462.951166985931,
    "settlement_residual": 8.715916877122253e-14
   },
   {
    "execution_residual": -86.89440199999983,
    "expected_profit": -1163.8365492036176,
    "family": "TEAM_TO_WIN_3WAY",
    "forecast_residual": 599.071648796383,
    "management_residual": 649.4997000000001,
    "n": 95,
    "outcome_variance": -15150.643148796382,
    "realized_profit": -15751.8744,
    "reconciliation_error": -1.1490183804419019e-12,
    "residual": -14588.037850796383,
    "settlement_residual": 8.702565404417051e-13
   },
   {
    "execution_residual": -0.12484499999998996,
    "expected_profit": -333.2423932282912,
    "family": "TOTAL",
    "forecast_residual": -52.264138228291024,
    "management_residual": 1.07,
    "n": 8,
    "outcome_variance": -2784.319561771709,
    "realized_profit": -3116.6168,
    "reconciliation_error": -9.936870797771016e-14,
    "residual": -2783.374406771709,
    "settlement_residual": -3.750749710818013e-14
   }
  ],
  "by_regime": [
   {
    "execution_residual": 3.9784999999996677,
    "expected_profit": -1915.8280036425388,
    "forecast_residual": -243.32450364253899,
    "management_residual": 0.0,
    "n": 50,
    "outcome_variance": -6659.340496357461,
    "realized_profit": -8571.19,
    "reconciliation_error": 2.9976021664879227e-14,
    "regime": "PREGAME",
    "residual": -6655.361996357461,
    "settlement_residual": 2.577989904883893e-13
   },
   {
    "execution_residual": -137.544224,
    "expected_profit": -2062.0776270509373,
    "forecast_residual": 751.0724239490637,
    "management_residual": -921.6481,
    "n": 144,
    "outcome_variance": -32043.19724894906,
    "realized_profit": -35164.4672,
    "reconciliation_error": -8.640213720813479e-13,
    "regime": "REGIME_UNKNOWN",
    "residual": -33102.38957294906,
    "settlement_residual": 8.02590459370034e-13
   }
  ],
  "by_strategy": [
   {
    "execution_residual": -108.55248699999991,
    "expected_profit": -612.7878336358513,
    "forecast_residual": 497.1429043641488,
    "management_residual": 623.7264000000002,
    "n": 65,
    "outcome_variance": -14820.573579364149,
    "realized_profit": -14918.1875,
    "reconciliation_error": -6.458787497887197e-13,
    "residual": -14305.399666364148,
    "settlement_residual": 6.174107752832114e-13,
    "strategy": "DEREK_ENTRY_POLICY_V2"
   },
   {
    "execution_residual": -48.69996600000002,
    "expected_profit": 414.52356416890603,
    "forecast_residual": 629.5759481689062,
    "management_residual": -2.4688999999999943,
    "n": 16,
    "outcome_variance": -2504.710098168906,
    "realized_profit": -2141.3554,
    "reconciliation_error": 6.806680192357126e-14,
    "residual": -2555.878964168906,
    "settlement_residual": 1.0280089279834925e-13,
    "strategy": "PINNACLE_COMPLETED_GAME_PAPER"
   },
   {
    "execution_residual": 23.68672899999958,
    "expected_profit": -3779.641361226531,
    "forecast_residual": -618.9709322265303,
    "management_residual": -1542.9056000000003,
    "n": 113,
    "outcome_variance": -21377.25406777347,
    "realized_profit": -26676.1143,
    "reconciliation_error": -2.562334025513202e-13,
    "residual": -22896.47293877347,
    "settlement_residual": 3.401777817768625e-13,
    "strategy": "PINNACLE_EXPLORATION_PAPER"
   }
  ],
  "by_strategy_sport_family_regime_venue": [
   {
    "cell": "DEREK_ENTRY_POLICY_V2|cnl|TEAM_TO_WIN_3WAY|REGIME_UNKNOWN|POLYMARKET_US",
    "execution_residual": -17.794059999999845,
    "expected_profit": -14.882151458119946,
    "forecast_residual": 24.33898854188006,
    "management_residual": 868.0200000000002,
    "outcome_variance": -804.04388854188,
    "positions": 2,
    "realized_profit": 31.299900000000076,
    "reconciliation_error": -4.440892098500626e-14,
    "residual": 46.18205145812002,
    "settlement_residual": -1.862027546040146e-13,
    "unique_events": 2
   },
   {
    "cell": "DEREK_ENTRY_POLICY_V2|intf|SOCCER_TEAM_FULL_TIME_WINNER|PREGAME|POLYMARKET_US",
    "execution_residual": -0.005400000000000273,
    "expected_profit": 4.184083637353652,
    "forecast_residual": 17.608683637353653,
    "management_residual": 0.0,
    "outcome_variance": -297.53868363735364,
    "positions": 1,
    "realized_profit": -293.36,
    "reconciliation_error": 5.684341886080802e-14,
    "residual": -297.54408363735365,
    "settlement_residual": -3.341771304121721e-14,
    "unique_events": 1
   },
   {
    "cell": "DEREK_ENTRY_POLICY_V2|intf|TEAM_TO_WIN_3WAY|REGIME_UNKNOWN|POLYMARKET_US",
    "execution_residual": -0.0016999999999999307,
    "expected_profit": -1.4974377883295582,
    "forecast_residual": 0.08586221167044217,
    "management_residual": 0.0,
    "outcome_variance": -38.070862211670445,
    "positions": 1,
    "realized_profit": -39.57,
    "reconciliation_error": -7.105427357601002e-15,
    "residual": -38.072562211670444,
    "settlement_residual": 7.882583474838611e-15,
    "unique_events": 1
   },
   {
    "cell": "DEREK_ENTRY_POLICY_V2|lal2|TEAM_TO_WIN_3WAY|REGIME_UNKNOWN|POLYMARKET_US",
    "execution_residual": -0.013300000000000452,
    "expected_profit": -26.698798993119443,
    "forecast_residual": -0.2770989931194361,
    "management_residual": 0.0,
    "outcome_variance": 404.1320989931195,
    "positions": 1,
    "realized_profit": 377.4200000000001,
    "reconciliation_error": 5.684341886080802e-14,
    "residual": 404.1187989931195,
    "settlement_residual": 0.0,
    "unique_events": 1
   },
   {
    "cell": "DEREK_ENTRY_POLICY_V2|lpa|TEAM_TO_WIN_3WAY|REGIME_UNKNOWN|POLYMARKET_US",
    "execution_residual": -3.8026220000000035,
    "expected_profit": -6.662226326285383,
    "forecast_residual": 10.802701673714619,
    "management_residual": -148.3,
    "outcome_variance": -46.599251673714605,
    "positions": 2,
    "realized_profit": -205.36409999999992,
    "reconciliation_error": -3.552713678800501e-15,
    "residual": -198.70187367371454,
    "settlement_residual": 7.131739643284618e-14,
    "unique_events": 2
   },
   {
    "cell": "DEREK_ENTRY_POLICY_V2|mlb|MONEYLINE|REGIME_UNKNOWN|POLYMARKET_US",
    "execution_residual": -8.903500000000008,
    "expected_profit": -10.692540175501202,
    "forecast_residual": 41.926459824498835,
    "management_residual": 0.0,
    "outcome_variance": -1964.213959824499,
    "positions": 2,
    "realized_profit": -1983.8100000000002,
    "reconciliation_error": 1.1368683772161603e-13,
    "residual": -1973.117459824499,
    "settlement_residual": -1.9817480989559044e-13,
    "unique_events": 2
   },
   {
    "cell": "DEREK_ENTRY_POLICY_V2|mlb|SPREAD|REGIME_UNKNOWN|POLYMARKET_US",
    "execution_residual": 0.000869999999999999,
    "expected_profit": 0.00047457673378302495,
    "forecast_residual": 0.005369576733783027,
    "management_residual": 0.0,
    "outcome_variance": 0.048455423266216976,
    "positions": 2,
    "realized_profit": 0.0498,
    "reconciliation_error": -6.5052130349130266e-18,
    "residual": 0.04932542326621697,
    "settlement_residual": 0.0,
    "unique_events": 1
   },
   {
    "cell": "DEREK_ENTRY_POLICY_V2|mls|SOCCER_TEAM_FULL_TIME_WINNER|PREGAME|POLYMARKET_US",
    "execution_residual": 0.0019999999998394392,
    "expected_profit": -22.866842762288876,
    "forecast_residual": 7.415157237710971,
    "management_residual": 0.0,
    "outcome_variance": -970.265157237711,
    "positions": 1,
    "realized_profit": -993.1300000000001,
    "reconciliation_error": 0.0,
    "residual": -970.2631572377112,
    "settlement_residual": 0.0,
    "unique_events": 1
   },
   {
    "cell": "DEREK_ENTRY_POLICY_V2|nba|TOTAL|REGIME_UNKNOWN|POLYMARKET_US",
    "execution_residual": 0.00020699999999999966,
    "expected_profit": -0.009217777552750614,
    "forecast_residual": 0.003939222447249388,
    "management_residual": 0.0,
    "outcome_variance": -0.3077892224472494,
    "positions": 1,
    "realized_profit": -0.3168,
    "reconciliation_error": 0.0,
    "residual": -0.3075822224472494,
    "settlement_residual": -6.550315845288423e-17,
    "unique_events": 1
   },
   {
    "cell": "DEREK_ENTRY_POLICY_V2|nfl|SPREAD|REGIME_UNKNOWN|POLYMARKET_US",
    "execution_residual": -8.36260000000001,
    "expected_profit": -21.547255330172508,